{
  "id": "values",
  "name": {
    "zh": "價值觀與未來",
    "en": "Values & Future"
  },
  "description": {
    "zh": "從核心價值、金錢與家庭，到生活方向、遠距、關係定位與社交界線，在生活選擇裡看見彼此有多合拍。",
    "en": "From core values, money, and family to life direction, long distance, where you stand, and social boundaries—see how well you fit in the choices of everyday life."
  },
  "colors": {
    "primary": "#574A9E",
    "secondary": "#8F84C9",
    "background": "#221C3F",
    "backgroundEnd": "#2E2857",
    "text": "#F2F1FA",
    "cardBack": "#3B3170"
  },
  "endMessage": {
    "zh": "謝謝你們把重要的選擇攤開來聊。想法不一樣的地方，也可以先放著，改天再談。",
    "en": "Thank you for laying the choices that matter on the table. Where you differ, it's okay to set it down for now and come back another day."
  },
  "cards": [
    {
      "id": "val-001",
      "level": 1,
      "text": {
        "zh": "現在的你，最重視生活中的哪三件事？想聽聽它們為什麼重要。",
        "en": "What are the three things you value most in life right now? I'd love to hear why each one matters.",
        "th": "What are the three things you value most in life right now? I'd love to hear why each one matters.",
        "ja": "What are the three things you value most in life right now? I'd love to hear why each one matters."
      }
    },
    {
      "id": "val-002",
      "level": 1,
      "text": {
        "zh": "對你來說，一段舒服的關係需要有哪些感覺？",
        "en": "For you, what should a comfortable relationship feel like—what feelings does it need to have?",
        "th": "For you, what should a comfortable relationship feel like—what feelings does it need to have?",
        "ja": "For you, what should a comfortable relationship feel like—what feelings does it need to have?"
      }
    },
    {
      "id": "val-003",
      "level": 1,
      "text": {
        "zh": "現在的你，希望感情在生活裡占有什麼樣的位置？",
        "en": "At this point in your life, what place would you like love to hold in it?",
        "th": "At this point in your life, what place would you like love to hold in it?",
        "ja": "At this point in your life, what place would you like love to hold in it?"
      }
    },
    {
      "id": "val-004",
      "level": 2,
      "text": {
        "zh": "在一段關係裡，陪伴和個人自由如果有衝突，你希望彼此怎麼找到平衡？",
        "en": "In a relationship, when time together and personal freedom pull in different directions, how would you like both sides to find a balance?",
        "th": "In a relationship, when time together and personal freedom pull in different directions, how would you like both sides to find a balance?",
        "ja": "In a relationship, when time together and personal freedom pull in different directions, how would you like both sides to find a balance?"
      }
    },
    {
      "id": "val-005",
      "level": 2,
      "text": {
        "zh": "過去的感情或人際經驗裡，有沒有一個你學到、現在很珍惜的原則？",
        "en": "From past relationships or friendships, is there a principle you learned that you now hold dear?",
        "th": "From past relationships or friendships, is there a principle you learned that you now hold dear?",
        "ja": "From past relationships or friendships, is there a principle you learned that you now hold dear?"
      }
    },
    {
      "id": "val-006",
      "level": 3,
      "text": {
        "zh": "有哪些對你很重要的價值，即使很喜歡一個人，也不希望自己勉強退讓？",
        "en": "What values matter so much to you that even for someone you really like, you wouldn't want to force yourself to give them up?",
        "th": "What values matter so much to you that even for someone you really like, you wouldn't want to force yourself to give them up?",
        "ja": "What values matter so much to you that even for someone you really like, you wouldn't want to force yourself to give them up?"
      }
    },
    {
      "id": "val-007",
      "level": 1,
      "text": {
        "zh": "什麼樣的花費會讓你覺得很值得？哪些事情你覺得夠用就好？",
        "en": "What kind of spending feels truly worth it to you—and where is \"good enough\" simply enough?",
        "th": "What kind of spending feels truly worth it to you—and where is \"good enough\" simply enough?",
        "ja": "What kind of spending feels truly worth it to you—and where is \"good enough\" simply enough?"
      }
    },
    {
      "id": "val-008",
      "level": 1,
      "text": {
        "zh": "如果突然多了一筆可以自由運用的錢，你會比較想拿來享受生活、完成目標，還是留給未來？為什麼？",
        "en": "If you suddenly had extra money to use freely, would you rather enjoy life with it, put it toward a goal, or save it for the future? Why?",
        "th": "If you suddenly had extra money to use freely, would you rather enjoy life with it, put it toward a goal, or save it for the future? Why?",
        "ja": "If you suddenly had extra money to use freely, would you rather enjoy life with it, put it toward a goal, or save it for the future? Why?"
      }
    },
    {
      "id": "val-009",
      "level": 2,
      "text": {
        "zh": "你覺得一段關係發展到什麼程度，適合開始談收入、負債和儲蓄狀況？",
        "en": "At what point in a relationship do you think it's right to start talking about income, debt, and savings?",
        "th": "At what point in a relationship do you think it's right to start talking about income, debt, and savings?",
        "ja": "At what point in a relationship do you think it's right to start talking about income, debt, and savings?"
      }
    },
    {
      "id": "val-010",
      "level": 2,
      "text": {
        "zh": "兩個人一起吃飯、旅行或生活時，怎麼分擔支出會讓你最舒服？",
        "en": "When two people share meals, trips, or daily life, what way of splitting expenses feels most comfortable to you?",
        "th": "When two people share meals, trips, or daily life, what way of splitting expenses feels most comfortable to you?",
        "ja": "When two people share meals, trips, or daily life, what way of splitting expenses feels most comfortable to you?"
      }
    },
    {
      "id": "val-011",
      "level": 3,
      "text": {
        "zh": "如果我們之中有人遇到財務困難，你覺得在開口借錢或出手幫忙之前，哪些事情需要先談清楚？",
        "en": "If one of us ran into financial trouble, what would need to be talked through before asking for—or offering—money?",
        "th": "If one of us ran into financial trouble, what would need to be talked through before asking for—or offering—money?",
        "ja": "If one of us ran into financial trouble, what would need to be talked through before asking for—or offering—money?"
      }
    },
    {
      "id": "val-012",
      "level": 3,
      "text": {
        "zh": "關於未來想不想有小孩，你現在真實的想法是什麼？還沒有答案、或有猶豫，也都想聽聽。",
        "en": "About whether you'd want kids someday—what are your honest thoughts right now? No answer yet, or mixed feelings, are just as welcome.",
        "th": "About whether you'd want kids someday—what are your honest thoughts right now? No answer yet, or mixed feelings, are just as welcome.",
        "ja": "About whether you'd want kids someday—what are your honest thoughts right now? No answer yet, or mixed feelings, are just as welcome."
      }
    },
    {
      "id": "val-013",
      "level": 3,
      "text": {
        "zh": "如果未來需要長期照顧或支援家人，你覺得哪些事情會自己決定，哪些會想和身邊的另一半一起討論？",
        "en": "If you ever needed to support or care for family long-term, which decisions would you make on your own, and which would you want to talk through with your other half?",
        "th": "If you ever needed to support or care for family long-term, which decisions would you make on your own, and which would you want to talk through with your other half?",
        "ja": "If you ever needed to support or care for family long-term, which decisions would you make on your own, and which would you want to talk through with your other half?"
      }
    },
    {
      "id": "val-014",
      "level": 1,
      "text": {
        "zh": "如果可以自由安排，你理想中的普通一天會怎麼度過？",
        "en": "If you could arrange it freely, what would your ideal ordinary day look like?",
        "th": "If you could arrange it freely, what would your ideal ordinary day look like?",
        "ja": "If you could arrange it freely, what would your ideal ordinary day look like?"
      }
    },
    {
      "id": "val-015",
      "level": 2,
      "text": {
        "zh": "如果重要的工作機會和感情發展無法同時兼顧，你做決定時最在意哪些事？",
        "en": "If a big career opportunity and a growing relationship couldn't both fit, what would matter most to you in making the call?",
        "th": "If a big career opportunity and a growing relationship couldn't both fit, what would matter most to you in making the call?",
        "ja": "If a big career opportunity and a growing relationship couldn't both fit, what would matter most to you in making the call?"
      }
    },
    {
      "id": "val-016",
      "level": 2,
      "text": {
        "zh": "遠距時，你希望彼此分享哪些日常，才會感覺有參與對方的生活，又不會失去自己的空間？",
        "en": "In a long-distance stretch, what parts of daily life would you want to share so you both feel part of each other's world—without losing your own space?",
        "th": "In a long-distance stretch, what parts of daily life would you want to share so you both feel part of each other's world—without losing your own space?",
        "ja": "In a long-distance stretch, what parts of daily life would you want to share so you both feel part of each other's world—without losing your own space?"
      }
    },
    {
      "id": "val-017",
      "level": 3,
      "text": {
        "zh": "如果我們因為不同城市或國家而遠距，當關係越來越認真時，你覺得縮短距離需要哪些條件？",
        "en": "If we were long-distance across cities or countries and things got serious, what would it take, in your view, to close the distance?",
        "th": "If we were long-distance across cities or countries and things got serious, what would it take, in your view, to close the distance?",
        "ja": "If we were long-distance across cities or countries and things got serious, what would it take, in your view, to close the distance?"
      }
    },
    {
      "id": "val-018",
      "level": 1,
      "text": {
        "zh": "對你來說，從聊天、約會到確認關係，哪些事情需要彼此明確說開，而不能只靠感覺猜？",